root@lamp-ubuntu-s-1vcpu-1gb-tor1-01:~# tcpdump -i eth0 tcp

tcpdump: verbose output suppressed, use -v or -vv for full protocol decode
listening on eth0, link-type EN10MB (Ethernet), capture size 262144 bytes
21:34:31.335812 IP 138.197.151.44.ssh > dsl-204-19-189-121.cooptel.qc.ca.60376: Flags [P.], seq 351171474:351171582, ack 2488462086, win 501, length 108
21:34:31.336077 IP 138.197.151.44.ssh > dsl-204-19-189-121.cooptel.qc.ca.60376: Flags [P.], seq 108:144, ack 1, win 501, length 36
21:34:31.336150 IP 138.197.151.44.ssh > dsl-204-19-189-121.cooptel.qc.ca.60376: Flags [P.], seq 144:252, ack 1, win 501, length 108
21:34:31.336405 IP 138.197.151.44.ssh > dsl-204-19-189-121.cooptel.qc.ca.60376: Flags [P.], seq 252:288, ack 1, win 501, length 36
21:34:31.344900 IP dsl-204-19-189-121.cooptel.qc.ca.60376 > 138.197.151.44.ssh: Flags [.], ack 288, win 511, length 0
21:34:31.374128 IP 138.197.151.44.ssh > 59.37.47.26.40932: Flags [P.], seq 3552035327:3552035395, ack 370762850, win 507, options [nop,nop,TS val 3075366662 ecr 444230862], length 68
21:34:31.374307 IP 138.197.151.44.ssh > dsl-204-19-189-121.cooptel.qc.ca.60376: Flags [P.], seq 288:476, ack 1, win 501, length 188
21:34:31.374553 IP 138.197.151.44.ssh > dsl-204-19-189-121.cooptel.qc.ca.60376: Flags [P.], seq 476:676, ack 1, win 501, length 200
21:34:31.374710 IP 138.197.151.44.ssh > dsl-204-19-189-121.cooptel.qc.ca.60376: Flags [P.], seq 676:712, ack 1, win 501, length 36
21:34:31.374874 IP 138.197.151.44.ssh > dsl-204-19-189-121.cooptel.qc.ca.60376: Flags [P.], seq 712:884, ack 1, win 501, length 172
21:34:31.374999 IP 138.197.151.44.ssh > dsl-204-19-189-121.cooptel.qc.ca.60376: Flags [P.], seq 884:920, ack 1, win 501, length 36
21:34:31.375162 IP 138.197.151.44.ssh > dsl-204-19-189-121.cooptel.qc.ca.60376: Flags [P.], seq 920:1084, ack 1, win 501, length 164
21:34:31.375290 IP 138.197.151.44.ssh > dsl-204-19-189-121.cooptel.qc.ca.60376: Flags [P.], seq 1084:1120, ack 1, win 501, length 36
21:34:31.375443 IP 138.197.151.44.ssh > dsl-204-19-189-121.cooptel.qc.ca.60376: Flags [P.], seq 1120:1276, ack 1, win 501, length 156
21:34:31.375561 IP 138.197.151.44.ssh > dsl-204-19-189-121.cooptel.qc.ca.60376: Flags [P.], seq 1276:1312, ack 1, win 501, length 36
21:34:31.376816 IP 138.197.151.44.ssh > dsl-204-19-189-121.cooptel.qc.ca.60376: Flags [P.], seq 1312:1532, ack 1, win 501, length 220
21:34:31.383367 IP dsl-204-19-189-121.cooptel.qc.ca.60376 > 138.197.151.44.ssh: Flags [.], ack 920, win 515, length 0
21:34:31.383470 IP 138.197.151.44.ssh > dsl-204-19-189-121.cooptel.qc.ca.60376: Flags [P.], seq 1532:3632, ack 1, win 501, length 2100
21:34:31.383693 IP 138.197.151.44.ssh > dsl-204-19-189-121.cooptel.qc.ca.60376: Flags [P.], seq 3632:3788, ack 1, win 501, length 156
21:34:31.383842 IP 138.197.151.44.ssh > dsl-204-19-189-121.cooptel.qc.ca.60376: Flags [P.], seq 3788:3824, ack 1, win 501, length 36
21:34:31.383933 IP dsl-204-19-189-121.cooptel.qc.ca.60376 > 138.197.151.44.ssh: Flags [.], ack 1312, win 513, length 0
21:34:31.384056 IP 138.197.151.44.ssh > dsl-204-19-189-121.cooptel.qc.ca.60376: Flags [P.], seq 3824:3996, ack 1, win 501, length 172
21:34:31.384182 IP 138.197.151.44.ssh > dsl-204-19-189-121.cooptel.qc.ca.60376: Flags [P.], seq 3996:4032, ack 1, win 501, length 36
21:34:31.384347 IP 138.197.151.44.ssh > dsl-204-19-189-121.cooptel.qc.ca.60376: Flags [P.], seq 4032:4204, ack 1, win 501, length 172
21:34:31.384460 IP 138.197.151.44.ssh > dsl-204-19-189-121.cooptel.qc.ca.60376: Flags [P.], seq 4204:4240, ack 1, win 501, length 36
21:34:31.384570 IP 138.197.151.44.ssh > dsl-204-19-189-121.cooptel.qc.ca.60376: Flags [P.], seq 4240:4412, ack 1, win 501, length 172
21:34:31.384652 IP 138.197.151.44.ssh > dsl-204-19-189-121.cooptel.qc.ca.60376: Flags [P.], seq 4412:4448, ack 1, win 501, length 36
21:34:31.384778 IP 138.197.151.44.ssh > dsl-204-19-189-121.cooptel.qc.ca.60376: Flags [P.], seq 4448:4604, ack 1, win 501, length 156
21:34:31.384878 IP 138.197.151.44.ssh > dsl-204-19-189-121.cooptel.qc.ca.60376: Flags [P.], seq 4604:4640, ack 1, win 501, length 36
21:34:31.385001 IP 138.197.151.44.ssh > dsl-204-19-189-121.cooptel.qc.ca.60376: Flags [P.], seq 4640:4812, ack 1, win 501, length 172
21:34:31.385098 IP 138.197.151.44.ssh > dsl-204-19-189-121.cooptel.qc.ca.60376: Flags [P.], seq 4812:4848, ack 1, win 501, length 36
21:34:31.385198 IP 138.197.151.44.ssh > dsl-204-19-189-121.cooptel.qc.ca.60376: Flags [P.], seq 4848:5020, ack 1, win 501, length 172
21:34:31.385313 IP 138.197.151.44.ssh > dsl-204-19-189-121.cooptel.qc.ca.60376: Flags [P.], seq 5020:5056, ack 1, win 501, length 36
21:34:31.385372 IP 138.197.151.44.ssh > dsl-204-19-189-121.cooptel.qc.ca.60376: Flags [P.], seq 5056:5228, ack 1, win 501, length 172
21:34:31.385498 IP 138.197.151.44.ssh > dsl-204-19-189-121.cooptel.qc.ca.60376: Flags [P.], seq 5228:5264, ack 1, win 501, length 36
21:34:31.385584 IP dsl-204-19-189-121.cooptel.qc.ca.60376 > 138.197.151.44.ssh: Flags [.], ack 1532, win 512, length 0
21:34:31.385615 IP 138.197.151.44.ssh > dsl-204-19-189-121.cooptel.qc.ca.60376: Flags [P.], seq 5264:5436, ack 1, win 501, length 172
21:34:31.385706 IP 138.197.151.44.ssh > dsl-204-19-189-121.cooptel.qc.ca.60376: Flags [P.], seq 5436:5472, ack 1, win 501, length 36
21:34:31.392694 IP dsl-204-19-189-121.cooptel.qc.ca.60376 > 138.197.151.44.ssh: Flags [.], ack 4032, win 515, length 0
21:34:31.392770 IP 138.197.151.44.ssh > dsl-204-19-189-121.cooptel.qc.ca.60376: Flags [P.], seq 5472:8160, ack 1, win 501, length 2688
21:34:31.392967 IP 138.197.151.44.ssh > dsl-204-19-189-121.cooptel.qc.ca.60376: Flags [P.], seq 8160:8316, ack 1, win 501, length 156
21:34:31.393126 IP dsl-204-19-189-121.cooptel.qc.ca.60376 > 138.197.151.44.ssh: Flags [.], ack 4640, win 512, length 0
21:34:31.393227 IP 138.197.151.44.ssh > dsl-204-19-189-121.cooptel.qc.ca.60376: Flags [P.], seq 8316:8352, ack 1, win 501, length 36
21:34:31.393447 IP 138.197.151.44.ssh > dsl-204-19-189-121.cooptel.qc.ca.60376: Flags [P.], seq 8352:8524, ack 1, win 501, length 172
21:34:31.393611 IP 138.197.151.44.ssh > dsl-204-19-189-121.cooptel.qc.ca.60376: Flags [P.], seq 8524:8560, ack 1, win 501, length 36
21:34:31.393774 IP dsl-204-19-189-121.cooptel.qc.ca.60376 > 138.197.151.44.ssh: Flags [.], ack 5264, win 510, length 0
21:34:31.393897 IP 138.197.151.44.ssh > dsl-204-19-189-121.cooptel.qc.ca.60376: Flags [P.], seq 8560:8732, ack 1, win 501, length 172
21:34:31.394107 IP 138.197.151.44.ssh > dsl-204-19-189-121.cooptel.qc.ca.60376: Flags [P.], seq 8732:8768, ack 1, win 501, length 36
21:34:31.394345 IP 138.197.151.44.ssh > dsl-204-19-189-121.cooptel.qc.ca.60376: Flags [P.], seq 8768:8924, ack 1, win 501, length 156
21:34:31.394424 IP dsl-204-19-189-121.cooptel.qc.ca.60376 > 138.197.151.44.ssh: Flags [.], ack 5472, win 515, length 0
21:34:31.394577 IP 138.197.151.44.ssh > dsl-204-19-189-121.cooptel.qc.ca.60376: Flags [P.], seq 8924:8960, ack 1, win 501, length 36
21:34:31.394783 IP 138.197.151.44.ssh > dsl-204-19-189-121.cooptel.qc.ca.60376: Flags [P.], seq 8960:9132, ack 1, win 501, length 172
21:34:31.395008 IP 138.197.151.44.ssh > dsl-204-19-189-121.cooptel.qc.ca.60376: Flags [P.], seq 9132:9304, ack 1, win 501, length 172
21:34:31.395319 IP 138.197.151.44.ssh > dsl-204-19-189-121.cooptel.qc.ca.60376: Flags [P.], seq 9304:9860, ack 1, win 501, length 556
21:34:31.395692 IP 138.197.151.44.ssh > dsl-204-19-189-121.cooptel.qc.ca.60376: Flags [P.], seq 9860:10688, ack 1, win 501, length 828
21:34:31.395922 IP 138.197.151.44.ssh > dsl-204-19-189-121.cooptel.qc.ca.60376: Flags [P.], seq 10688:10860, ack 1, win 501, length 172
21:34:31.396163 IP 138.197.151.44.ssh > dsl-204-19-189-121.cooptel.qc.ca.60376: Flags [P.], seq 10860:11032, ack 1, win 501, length 172
21:34:31.396470 IP 138.197.151.44.ssh > dsl-204-19-189-121.cooptel.qc.ca.60376: Flags [P.], seq 11032:11204, ack 1, win 501, length 172
21:34:31.396699 IP 138.197.151.44.ssh > dsl-204-19-189-121.cooptel.qc.ca.60376: Flags [P.], seq 11204:11376, ack 1, win 501, length 172
21:34:31.396926 IP 138.197.151.44.ssh > dsl-204-19-189-121.cooptel.qc.ca.60376: Flags [P.], seq 11376:11548, ack 1, win 501, length 172
21:34:31.397157 IP 138.197.151.44.ssh > dsl-204-19-189-121.cooptel.qc.ca.60376: Flags [P.], seq 11548:11720, ack 1, win 501, length 172
21:34:31.397400 IP 138.197.151.44.ssh > dsl-204-19-189-121.cooptel.qc.ca.60376: Flags [P.], seq 11720:11892, ack 1, win 501, length 172
21:34:31.397633 IP 138.197.151.44.ssh > dsl-204-19-189-121.cooptel.qc.ca.60376: Flags [P.], seq 11892:12064, ack 1, win 501, length 172
21:34:31.397861 IP 138.197.151.44.ssh > dsl-204-19-189-121.cooptel.qc.ca.60376: Flags [P.], seq 12064:12236, ack 1, win 501, length 172
21:34:31.398533 IP 138.197.151.44.ssh > dsl-204-19-189-121.cooptel.qc.ca.60376: Flags [P.], seq 12236:12408, ack 1, win 501, length 172
21:34:31.398778 IP 138.197.151.44.ssh > dsl-204-19-189-121.cooptel.qc.ca.60376: Flags [P.], seq 12408:12580, ack 1, win 501, length 172
21:34:31.399013 IP 138.197.151.44.ssh > dsl-204-19-189-121.cooptel.qc.ca.60376: Flags [P.], seq 12580:12752, ack 1, win 501, length 172
21:34:31.399196 IP 138.197.151.44.ssh > dsl-204-19-189-121.cooptel.qc.ca.60376: Flags [P.], seq 12752:12924, ack 1, win 501, length 172
21:34:31.399380 IP 138.197.151.44.ssh > dsl-204-19-189-121.cooptel.qc.ca.60376: Flags [P.], seq 12924:13096, ack 1, win 501, length 172
21:34:31.399550 IP 138.197.151.44.ssh > dsl-204-19-189-121.cooptel.qc.ca.60376: Flags [P.], seq 13096:13268, ack 1, win 501, length 172
21:34:31.399711 IP 138.197.151.44.ssh > dsl-204-19-189-121.cooptel.qc.ca.60376: Flags [P.], seq 13268:13440, ack 1, win 501, length 172
21:34:31.399882 IP 138.197.151.44.ssh > dsl-204-19-189-121.cooptel.qc.ca.60376: Flags [P.], seq 13440:13612, ack 1, win 501, length 172
21:34:31.400053 IP 138.197.151.44.ssh > dsl-204-19-189-121.cooptel.qc.ca.60376: Flags [P.], seq 13612:13784, ack 1, win 501, length 172
21:34:31.400260 IP 138.197.151.44.ssh > dsl-204-19-189-121.cooptel.qc.ca.60376: Flags [P.], seq 13784:13956, ack 1, win 501, length 172
21:34:31.400437 IP 138.197.151.44.ssh > dsl-204-19-189-121.cooptel.qc.ca.60376: Flags [P.], seq 13956:14128, ack 1, win 501, length 172
21:34:31.400606 IP 138.197.151.44.ssh > dsl-204-19-189-121.cooptel.qc.ca.60376: Flags [P.], seq 14128:14300, ack 1, win 501, length 172
21:34:31.400772 IP 138.197.151.44.ssh > dsl-204-19-189-121.cooptel.qc.ca.60376: Flags [P.], seq 14300:14472, ack 1, win 501, length 172
21:34:31.400934 IP 138.197.151.44.ssh > dsl-204-19-189-121.cooptel.qc.ca.60376: Flags [P.], seq 14472:14644, ack 1, win 501, length 172
21:34:31.401140 IP 138.197.151.44.ssh > dsl-204-19-189-121.cooptel.qc.ca.60376: Flags [P.], seq 14644:14816, ack 1, win 501, length 172
21:34:31.401354 IP 138.197.151.44.ssh > dsl-204-19-189-121.cooptel.qc.ca.60376: Flags [P.], seq 14816:14988, ack 1, win 501, length 172
21:34:31.401514 IP 138.197.151.44.ssh > dsl-204-19-189-121.cooptel.qc.ca.60376: Flags [P.], seq 14988:15160, ack 1, win 501, length 172
21:34:31.401930 IP dsl-204-19-189-121.cooptel.qc.ca.60376 > 138.197.151.44.ssh: Flags [.], ack 8524, win 515, length 0
21:34:31.401975 IP 138.197.151.44.ssh > dsl-204-19-189-121.cooptel.qc.ca.60376: Flags [P.], seq 15160:15332, ack 1, win 501, length 172
21:34:31.402199 IP 138.197.151.44.ssh > dsl-204-19-189-121.cooptel.qc.ca.60376: Flags [P.], seq 15332:15624, ack 1, win 501, length 292
21:34:31.402479 IP dsl-204-19-189-121.cooptel.qc.ca.60376 > 138.197.151.44.ssh: Flags [.], ack 8732, win 514, length 0
21:34:31.402521 IP 138.197.151.44.ssh > dsl-204-19-189-121.cooptel.qc.ca.60376: Flags [P.], seq 15624:15796, ack 1, win 501, length 172
21:34:31.402767 IP 138.197.151.44.ssh > dsl-204-19-189-121.cooptel.qc.ca.60376: Flags [P.], seq 15796:16088, ack 1, win 501, length 292
21:34:31.402932 IP 138.197.151.44.ssh > dsl-204-19-189-121.cooptel.qc.ca.60376: Flags [P.], seq 16088:16260, ack 1, win 501, length 172
21:34:31.403094 IP 138.197.151.44.ssh > dsl-204-19-189-121.cooptel.qc.ca.60376: Flags [P.], seq 16260:16432, ack 1, win 501, length 172
21:34:31.403326 IP dsl-204-19-189-121.cooptel.qc.ca.60376 > 138.197.151.44.ssh: Flags [.], ack 9132, win 512, length 0
21:34:31.403379 IP 138.197.151.44.ssh > dsl-204-19-189-121.cooptel.qc.ca.60376: Flags [P.], seq 16432:16604, ack 1, win 501, length 172
21:34:31.403619 IP 138.197.151.44.ssh > dsl-204-19-189-121.cooptel.qc.ca.60376: Flags [P.], seq 16604:16896, ack 1, win 501, length 292
21:34:31.403772 IP 138.197.151.44.ssh > dsl-204-19-189-121.cooptel.qc.ca.60376: Flags [P.], seq 16896:17068, ack 1, win 501, length 172
21:34:31.403813 IP dsl-204-19-189-121.cooptel.qc.ca.60376 > 138.197.151.44.ssh: Flags [.], ack 9860, win 510, length 0
21:34:31.403961 IP 138.197.151.44.ssh > dsl-204-19-189-121.cooptel.qc.ca.60376: Flags [P.], seq 17068:17360, ack 1, win 501, length 292
21:34:31.404102 IP 138.197.151.44.ssh > dsl-204-19-189-121.cooptel.qc.ca.60376: Flags [P.], seq 17360:17532, ack 1, win 501, length 172
21:34:31.404281 IP 138.197.151.44.ssh > dsl-204-19-189-121.cooptel.qc.ca.60376: Flags [P.], seq 17532:17704, ack 1, win 501, length 172
21:34:31.404474 IP 138.197.151.44.ssh > dsl-204-19-189-121.cooptel.qc.ca.60376: Flags [P.], seq 17704:17876, ack 1, win 501, length 172
21:34:31.404632 IP dsl-204-19-189-121.cooptel.qc.ca.60376 > 138.197.151.44.ssh: Flags [.], ack 11032, win 515, length 0
21:34:31.404713 IP 138.197.151.44.ssh > dsl-204-19-189-121.cooptel.qc.ca.60376: Flags [P.], seq 17876:18048, ack 1, win 501, length 172
21:34:31.404917 IP 138.197.151.44.ssh > dsl-204-19-189-121.cooptel.qc.ca.60376: Flags [P.], seq 18048:18340, ack 1, win 501, length 292
21:34:31.405095 IP 138.197.151.44.ssh > dsl-204-19-189-121.cooptel.qc.ca.60376: Flags [P.], seq 18340:18512, ack 1, win 501, length 172
21:34:31.405254 IP 138.197.151.44.ssh > dsl-204-19-189-121.cooptel.qc.ca.60376: Flags [P.], seq 18512:18684, ack 1, win 501, length 172
21:34:31.405422 IP 138.197.151.44.ssh > dsl-204-19-189-121.cooptel.qc.ca.60376: Flags [P.], seq 18684:18856, ack 1, win 501, length 172
21:34:31.405586 IP dsl-204-19-189-121.cooptel.qc.ca.60376 > 138.197.151.44.ssh: Flags [.], ack 11548, win 513, length 0
21:34:31.405704 IP 138.197.151.44.ssh > dsl-204-19-189-121.cooptel.qc.ca.60376: Flags [P.], seq 18856:19028, ack 1, win 501, length 172
21:34:31.405858 IP 138.197.151.44.ssh > dsl-204-19-189-121.cooptel.qc.ca.60376: Flags [P.], seq 19028:19184, ack 1, win 501, length 156
21:34:31.406002 IP 138.197.151.44.ssh > dsl-204-19-189-121.cooptel.qc.ca.60376: Flags [P.], seq 19184:19356, ack 1, win 501, length 172
21:34:31.406104 IP dsl-204-19-189-121.cooptel.qc.ca.60376 > 138.197.151.44.ssh: Flags [.], ack 12064, win 511, length 0
21:34:31.406137 IP 138.197.151.44.ssh > dsl-204-19-189-121.cooptel.qc.ca.60376: Flags [P.], seq 19356:19528, ack 1, win 501, length 172
21:34:31.406352 IP 138.197.151.44.ssh > dsl-204-19-189-121.cooptel.qc.ca.60376: Flags [P.], seq 19528:19964, ack 1, win 501, length 436
21:34:31.406526 IP 138.197.151.44.ssh > dsl-204-19-189-121.cooptel.qc.ca.60376: Flags [P.], seq 19964:20136, ack 1, win 501, length 172
21:34:31.406700 IP 138.197.151.44.ssh > dsl-204-19-189-121.cooptel.qc.ca.60376: Flags [P.], seq 20136:20308, ack 1, win 501, length 172
21:34:31.406862 IP 138.197.151.44.ssh > dsl-204-19-189-121.cooptel.qc.ca.60376: Flags [P.], seq 20308:20480, ack 1, win 501, length 172
21:34:31.407031 IP 138.197.151.44.ssh > dsl-204-19-189-121.cooptel.qc.ca.60376: Flags [P.], seq 20480:20652, ack 1, win 501, length 172
21:34:31.407184 IP 138.197.151.44.ssh > dsl-204-19-189-121.cooptel.qc.ca.60376: Flags [P.], seq 20652:20824, ack 1, win 501, length 172
21:34:31.407319 IP dsl-204-19-189-121.cooptel.qc.ca.60376 > 138.197.151.44.ssh: Flags [.], ack 12752, win 515, length 0
21:34:31.407445 IP 138.197.151.44.ssh > dsl-204-19-189-121.cooptel.qc.ca.60376: Flags [P.], seq 20824:20996, ack 1, win 501, length 172
21:34:31.407536 IP 138.197.151.44.ssh > dsl-204-19-189-121.cooptel.qc.ca.60376: Flags [P.], seq 20996:21152, ack 1, win 501, length 156
21:34:31.407713 IP 138.197.151.44.ssh > dsl-204-19-189-121.cooptel.qc.ca.60376: Flags [P.], seq 21152:21460, ack 1, win 501, length 308
21:34:31.407880 IP 138.197.151.44.ssh > dsl-204-19-189-121.cooptel.qc.ca.60376: Flags [P.], seq 21460:21632, ack 1, win 501, length 172
21:34:31.407975 IP dsl-204-19-189-121.cooptel.qc.ca.60376 > 138.197.151.44.ssh: Flags [.], ack 13440, win 512, length 0
21:34:31.408115 IP 138.197.151.44.ssh > dsl-204-19-189-121.cooptel.qc.ca.60376: Flags [P.], seq 21632:21924, ack 1, win 501, length 292
21:34:31.408324 IP 138.197.151.44.ssh > dsl-204-19-189-121.cooptel.qc.ca.60376: Flags [P.], seq 21924:22096, ack 1, win 501, length 172
21:34:31.408485 IP 138.197.151.44.ssh > dsl-204-19-189-121.cooptel.qc.ca.60376: Flags [P.], seq 22096:22268, ack 1, win 501, length 172
21:34:31.408647 IP dsl-204-19-189-121.cooptel.qc.ca.60376 > 138.197.151.44.ssh: Flags [.], ack 13956, win 510, length 0
21:34:31.408775 IP 138.197.151.44.ssh > dsl-204-19-189-121.cooptel.qc.ca.60376: Flags [P.], seq 22268:22440, ack 1, win 501, length 172
21:34:31.408938 IP 138.197.151.44.ssh > dsl-204-19-189-121.cooptel.qc.ca.60376: Flags [P.], seq 22440:22596, ack 1, win 501, length 156
21:34:31.409028 IP 138.197.151.44.ssh > dsl-204-19-189-121.cooptel.qc.ca.60376: Flags [P.], seq 22596:22768, ack 1, win 501, length 172
21:34:31.409190 IP dsl-204-19-189-121.cooptel.qc.ca.60376 > 138.197.151.44.ssh: Flags [.], ack 14644, win 515, length 0
21:34:31.409351 IP 138.197.151.44.ssh > dsl-204-19-189-121.cooptel.qc.ca.60376: Flags [P.], seq 22768:23204, ack 1, win 501, length 436
21:34:31.409522 IP 138.197.151.44.ssh > dsl-204-19-189-121.cooptel.qc.ca.60376: Flags [P.], seq 23204:23376, ack 1, win 501, length 172
21:34:31.409641 IP dsl-204-19-189-121.cooptel.qc.ca.60376 > 138.197.151.44.ssh: Flags [P.], seq 1:37, ack 14644, win 515, length 36
21:34:31.409800 IP 138.197.151.44.ssh > dsl-204-19-189-121.cooptel.qc.ca.60376: Flags [P.], seq 23376:23684, ack 37, win 501, length 308
21:34:31.409889 IP dsl-204-19-189-121.cooptel.qc.ca.60376 > 138.197.151.44.ssh: Flags [.], ack 15160, win 513, length 0
21:34:31.410081 IP 138.197.151.44.ssh > dsl-204-19-189-121.cooptel.qc.ca.60376: Flags [P.], seq 23684:23984, ack 37, win 501, length 300
21:34:31.410267 IP 138.197.151.44.ssh > dsl-204-19-189-121.cooptel.qc.ca.60376: Flags [P.], seq 23984:24156, ack 37, win 501, length 172
21:34:31.410445 IP 138.197.151.44.ssh > dsl-204-19-189-121.cooptel.qc.ca.60376: Flags [P.], seq 24156:24328, ack 37, win 501, length 172
21:34:31.410615 IP 138.197.151.44.ssh > dsl-204-19-189-121.cooptel.qc.ca.60376: Flags [P.], seq 24328:24500, ack 37, win 501, length 172
21:34:31.410707 IP dsl-204-19-189-121.cooptel.qc.ca.60376 > 138.197.151.44.ssh: Flags [.], ack 15624, win 511, length 0
21:34:31.410848 IP 138.197.151.44.ssh > dsl-204-19-189-121.cooptel.qc.ca.60376: Flags [P.], seq 24500:24800, ack 37, win 501, length 300
21:34:31.411017 IP 138.197.151.44.ssh > dsl-204-19-189-121.cooptel.qc.ca.60376: Flags [P.], seq 24800:24972, ack 37, win 501, length 172
21:34:31.411184 IP 138.197.151.44.ssh > dsl-204-19-189-121.cooptel.qc.ca.60376: Flags [P.], seq 24972:25144, ack 37, win 501, length 172
21:34:31.411266 IP dsl-204-19-189-121.cooptel.qc.ca.60376 > 138.197.151.44.ssh: Flags [.], ack 16260, win 515, length 0
21:34:31.411413 IP 138.197.151.44.ssh > dsl-204-19-189-121.cooptel.qc.ca.60376: Flags [P.], seq 25144:25444, ack 37, win 501, length 300
21:34:31.411591 IP 138.197.151.44.ssh > dsl-204-19-189-121.cooptel.qc.ca.60376: Flags [P.], seq 25444:25616, ack 37, win 501, length 172
21:34:31.411754 IP 138.197.151.44.ssh > dsl-204-19-189-121.cooptel.qc.ca.60376: Flags [P.], seq 25616:25788, ack 37, win 501, length 172
21:34:31.411918 IP 138.197.151.44.ssh > dsl-204-19-189-121.cooptel.qc.ca.60376: Flags [P.], seq 25788:25960, ack 37, win 501, length 172
21:34:31.411972 IP dsl-204-19-189-121.cooptel.qc.ca.60376 > 138.197.151.44.ssh: Flags [.], ack 16896, win 512, length 0
21:34:31.412156 IP 138.197.151.44.ssh > dsl-204-19-189-121.cooptel.qc.ca.60376: Flags [P.], seq 25960:26260, ack 37, win 501, length 300
21:34:31.412345 IP 138.197.151.44.ssh > dsl-204-19-189-121.cooptel.qc.ca.60376: Flags [P.], seq 26260:26432, ack 37, win 501, length 172
21:34:31.412508 IP dsl-204-19-189-121.cooptel.qc.ca.60376 > 138.197.151.44.ssh: Flags [.], ack 17532, win 510, length 0
21:34:31.412621 IP 138.197.151.44.ssh > dsl-204-19-189-121.cooptel.qc.ca.60376: Flags [P.], seq 26432:26604, ack 37, win 501, length 172
21:34:31.412805 IP 138.197.151.44.ssh > dsl-204-19-189-121.cooptel.qc.ca.60376: Flags [P.], seq 26604:26904, ack 37, win 501, length 300
21:34:31.412961 IP 138.197.151.44.ssh > dsl-204-19-189-121.cooptel.qc.ca.60376: Flags [P.], seq 26904:27076, ack 37, win 501, length 172
21:34:31.413137 IP dsl-204-19-189-121.cooptel.qc.ca.60376 > 138.197.151.44.ssh: Flags [.], ack 18048, win 515, length 0