root@lamp-ubuntu-s-1vcpu-1gb-tor1-01:~# tcpdump -n -i eth0 -c 100
tcpdump: verbose output suppressed, use -v or -vv for full protocol decode
listening on eth0, link-type EN10MB (Ethernet), capture size 262144 bytes
09:41:37.768868 IP 134.122.37.253.22 > 72.141.119.228.61270: Flags [P.], seq 4253273104:4253273212, ack 2397457298, win 501, length 108
09:41:37.769021 IP 134.122.37.253.22 > 72.141.119.228.61270: Flags [P.], seq 108:144, ack 1, win 501, length 36
09:41:37.769141 IP 134.122.37.253.22 > 72.141.119.228.61270: Flags [P.], seq 144:252, ack 1, win 501, length 108
09:41:37.769245 IP 134.122.37.253.22 > 72.141.119.228.61270: Flags [P.], seq 252:288, ack 1, win 501, length 36
09:41:37.769523 IP 134.122.37.253.22 > 72.141.119.228.61270: Flags [P.], seq 288:460, ack 1, win 501, length 172
09:41:37.769631 IP 134.122.37.253.22 > 72.141.119.228.61270: Flags [P.], seq 460:496, ack 1, win 501, length 36
09:41:37.769762 IP 134.122.37.253.22 > 72.141.119.228.61270: Flags [P.], seq 496:644, ack 1, win 501, length 148
09:41:37.769870 IP 134.122.37.253.22 > 72.141.119.228.61270: Flags [P.], seq 644:680, ack 1, win 501, length 36
09:41:37.770005 IP 134.122.37.253.22 > 72.141.119.228.61270: Flags [P.], seq 680:828, ack 1, win 501, length 148
09:41:37.782703 IP 72.141.119.228.61270 > 134.122.37.253.22: Flags [.], ack 108, win 4136, length 0
09:41:37.782792 IP 134.122.37.253.22 > 72.141.119.228.61270: Flags [P.], seq 828:1968, ack 1, win 501, length 1140
09:41:37.782834 IP 72.141.119.228.61270 > 134.122.37.253.22: Flags [.], ack 252, win 4135, length 0
09:41:37.782855 IP 72.141.119.228.61270 > 134.122.37.253.22: Flags [.], ack 460, win 4135, length 0
09:41:37.782868 IP 72.141.119.228.61270 > 134.122.37.253.22: Flags [.], ack 644, win 4140, length 0
09:41:37.782879 IP 72.141.119.228.61270 > 134.122.37.253.22: Flags [.], ack 828, win 4139, length 0
09:41:37.783179 IP 134.122.37.253.22 > 72.141.119.228.61270: Flags [P.], seq 1968:2108, ack 1, win 501, length 140
09:41:37.783317 IP 134.122.37.253.22 > 72.141.119.228.61270: Flags [P.], seq 2108:2144, ack 1, win 501, length 36
09:41:37.783477 IP 134.122.37.253.22 > 72.141.119.228.61270: Flags [P.], seq 2144:2292, ack 1, win 501, length 148
09:41:37.783638 IP 134.122.37.253.22 > 72.141.119.228.61270: Flags [P.], seq 2292:2328, ack 1, win 501, length 36
09:41:37.783761 IP 134.122.37.253.22 > 72.141.119.228.61270: Flags [P.], seq 2328:2468, ack 1, win 501, length 140
09:41:37.783912 IP 134.122.37.253.22 > 72.141.119.228.61270: Flags [P.], seq 2468:2504, ack 1, win 501, length 36
09:41:37.784066 IP 134.122.37.253.22 > 72.141.119.228.61270: Flags [P.], seq 2504:2644, ack 1, win 501, length 140
09:41:37.784208 IP 134.122.37.253.22 > 72.141.119.228.61270: Flags [P.], seq 2644:2680, ack 1, win 501, length 36
09:41:37.784338 IP 134.122.37.253.22 > 72.141.119.228.61270: Flags [P.], seq 2680:2820, ack 1, win 501, length 140
09:41:37.784439 IP 134.122.37.253.22 > 72.141.119.228.61270: Flags [P.], seq 2820:2856, ack 1, win 501, length 36
09:41:37.784568 IP 134.122.37.253.22 > 72.141.119.228.61270: Flags [P.], seq 2856:2996, ack 1, win 501, length 140
09:41:37.784717 IP 134.122.37.253.22 > 72.141.119.228.61270: Flags [P.], seq 2996:3032, ack 1, win 501, length 36
09:41:37.784871 IP 134.122.37.253.22 > 72.141.119.228.61270: Flags [P.], seq 3032:3180, ack 1, win 501, length 148
09:41:37.784986 IP 134.122.37.253.22 > 72.141.119.228.61270: Flags [P.], seq 3180:3216, ack 1, win 501, length 36
09:41:37.785118 IP 134.122.37.253.22 > 72.141.119.228.61270: Flags [P.], seq 3216:3364, ack 1, win 501, length 148
09:41:37.785224 IP 134.122.37.253.22 > 72.141.119.228.61270: Flags [P.], seq 3364:3400, ack 1, win 501, length 36
09:41:37.785347 IP 134.122.37.253.22 > 72.141.119.228.61270: Flags [P.], seq 3400:3548, ack 1, win 501, length 148
09:41:37.785444 IP 134.122.37.253.22 > 72.141.119.228.61270: Flags [P.], seq 3548:3584, ack 1, win 501, length 36
09:41:37.785568 IP 134.122.37.253.22 > 72.141.119.228.61270: Flags [P.], seq 3584:3732, ack 1, win 501, length 148
09:41:37.801344 IP 72.141.119.228.61270 > 134.122.37.253.22: Flags [.], ack 2108, win 4140, length 0
09:41:37.801437 IP 134.122.37.253.22 > 72.141.119.228.61270: Flags [P.], seq 3732:6528, ack 1, win 501, length 2796
09:41:37.801481 IP 72.141.119.228.61270 > 134.122.37.253.22: Flags [.], ack 2292, win 4139, length 0
09:41:37.801496 IP 72.141.119.228.61270 > 134.122.37.253.22: Flags [.], ack 2468, win 4139, length 0
09:41:37.801509 IP 72.141.119.228.61270 > 134.122.37.253.22: Flags [.], ack 2644, win 4138, length 0
09:41:37.801528 IP 72.141.119.228.61270 > 134.122.37.253.22: Flags [.], ack 2820, win 4137, length 0
09:41:37.801538 IP 72.141.119.228.61270 > 134.122.37.253.22: Flags [.], ack 2996, win 4137, length 0
09:41:37.801780 IP 134.122.37.253.22 > 72.141.119.228.61270: Flags [P.], seq 6528:6668, ack 1, win 501, length 140
09:41:37.801930 IP 134.122.37.253.22 > 72.141.119.228.61270: Flags [P.], seq 6668:6704, ack 1, win 501, length 36
09:41:37.802027 IP 134.122.37.253.22 > 72.141.119.228.61270: Flags [P.], seq 6704:6860, ack 1, win 501, length 156
09:41:37.802125 IP 134.122.37.253.22 > 72.141.119.228.61270: Flags [P.], seq 6860:6896, ack 1, win 501, length 36
09:41:37.802240 IP 134.122.37.253.22 > 72.141.119.228.61270: Flags [P.], seq 6896:7036, ack 1, win 501, length 140
09:41:37.802334 IP 134.122.37.253.22 > 72.141.119.228.61270: Flags [P.], seq 7036:7072, ack 1, win 501, length 36
09:41:37.802445 IP 134.122.37.253.22 > 72.141.119.228.61270: Flags [P.], seq 7072:7212, ack 1, win 501, length 140
09:41:37.802540 IP 134.122.37.253.22 > 72.141.119.228.61270: Flags [P.], seq 7212:7248, ack 1, win 501, length 36
09:41:37.802655 IP 134.122.37.253.22 > 72.141.119.228.61270: Flags [P.], seq 7248:7388, ack 1, win 501, length 140
09:41:37.802745 IP 134.122.37.253.22 > 72.141.119.228.61270: Flags [P.], seq 7388:7424, ack 1, win 501, length 36
09:41:37.802855 IP 134.122.37.253.22 > 72.141.119.228.61270: Flags [P.], seq 7424:7564, ack 1, win 501, length 140
09:41:37.802997 IP 134.122.37.253.22 > 72.141.119.228.61270: Flags [P.], seq 7564:7600, ack 1, win 501, length 36
09:41:37.803063 IP 134.122.37.253.22 > 72.141.119.228.61270: Flags [P.], seq 7600:7740, ack 1, win 501, length 140
09:41:37.803208 IP 134.122.37.253.22 > 72.141.119.228.61270: Flags [P.], seq 7740:7776, ack 1, win 501, length 36
09:41:37.803325 IP 134.122.37.253.22 > 72.141.119.228.61270: Flags [P.], seq 7776:7924, ack 1, win 501, length 148
09:41:37.803449 IP 134.122.37.253.22 > 72.141.119.228.61270: Flags [P.], seq 7924:8192, ack 1, win 501, length 268
09:41:37.803594 IP 134.122.37.253.22 > 72.141.119.228.61270: Flags [P.], seq 8192:8692, ack 1, win 501, length 500
09:41:37.803742 IP 134.122.37.253.22 > 72.141.119.228.61270: Flags [P.], seq 8692:9192, ack 1, win 501, length 500
09:41:37.803899 IP 134.122.37.253.22 > 72.141.119.228.61270: Flags [P.], seq 9192:9804, ack 1, win 501, length 612
09:41:37.804045 IP 134.122.37.253.22 > 72.141.119.228.61270: Flags [P.], seq 9804:10192, ack 1, win 501, length 388
09:41:37.804183 IP 134.122.37.253.22 > 72.141.119.228.61270: Flags [P.], seq 10192:10348, ack 1, win 501, length 156
09:41:37.804297 IP 134.122.37.253.22 > 72.141.119.228.61270: Flags [P.], seq 10348:10504, ack 1, win 501, length 156
09:41:37.804641 IP 72.141.119.228.61270 > 134.122.37.253.22: Flags [.], ack 3180, win 4136, length 0
09:41:37.804699 IP 134.122.37.253.22 > 72.141.119.228.61270: Flags [P.], seq 10504:10660, ack 1, win 501, length 156
09:41:37.804724 IP 72.141.119.228.61270 > 134.122.37.253.22: Flags [.], ack 3364, win 4135, length 0
09:41:37.804734 IP 72.141.119.228.61270 > 134.122.37.253.22: Flags [.], ack 3548, win 4134, length 0
09:41:37.804744 IP 72.141.119.228.61270 > 134.122.37.253.22: Flags [.], ack 3732, win 4140, length 0
09:41:37.804969 IP 134.122.37.253.22 > 72.141.119.228.61270: Flags [P.], seq 10660:11224, ack 1, win 501, length 564
09:41:37.805117 IP 134.122.37.253.22 > 72.141.119.228.61270: Flags [P.], seq 11224:11380, ack 1, win 501, length 156
09:41:37.805322 IP 134.122.37.253.22 > 72.141.119.228.61270: Flags [P.], seq 11380:11536, ack 1, win 501, length 156
09:41:37.805493 IP 134.122.37.253.22 > 72.141.119.228.61270: Flags [P.], seq 11536:11692, ack 1, win 501, length 156
09:41:37.805620 IP 134.122.37.253.22 > 72.141.119.228.61270: Flags [P.], seq 11692:11848, ack 1, win 501, length 156
09:41:37.805731 IP 134.122.37.253.22 > 72.141.119.228.61270: Flags [P.], seq 11848:12004, ack 1, win 501, length 156
09:41:37.805839 IP 134.122.37.253.22 > 72.141.119.228.61270: Flags [P.], seq 12004:12160, ack 1, win 501, length 156
09:41:37.805948 IP 134.122.37.253.22 > 72.141.119.228.61270: Flags [P.], seq 12160:12316, ack 1, win 501, length 156
09:41:37.806057 IP 134.122.37.253.22 > 72.141.119.228.61270: Flags [P.], seq 12316:12472, ack 1, win 501, length 156
09:41:37.806189 IP 134.122.37.253.22 > 72.141.119.228.61270: Flags [P.], seq 12472:12628, ack 1, win 501, length 156
09:41:37.806306 IP 134.122.37.253.22 > 72.141.119.228.61270: Flags [P.], seq 12628:12784, ack 1, win 501, length 156
09:41:37.806414 IP 134.122.37.253.22 > 72.141.119.228.61270: Flags [P.], seq 12784:12940, ack 1, win 501, length 156
09:41:37.806522 IP 134.122.37.253.22 > 72.141.119.228.61270: Flags [P.], seq 12940:13096, ack 1, win 501, length 156
09:41:37.806629 IP 134.122.37.253.22 > 72.141.119.228.61270: Flags [P.], seq 13096:13252, ack 1, win 501, length 156
09:41:37.806736 IP 134.122.37.253.22 > 72.141.119.228.61270: Flags [P.], seq 13252:13408, ack 1, win 501, length 156
09:41:37.816001 IP 72.141.119.228.61270 > 134.122.37.253.22: Flags [.], ack 6528, win 4140, length 0
09:41:37.816102 IP 134.122.37.253.22 > 72.141.119.228.61270: Flags [P.], seq 13408:13564, ack 1, win 501, length 156
09:41:37.816132 IP 72.141.119.228.61270 > 134.122.37.253.22: Flags [.], ack 6704, win 4139, length 0
09:41:37.816619 IP 134.122.37.253.22 > 72.141.119.228.61270: Flags [P.], seq 13564:13920, ack 1, win 501, length 356
09:41:37.816884 IP 134.122.37.253.22 > 72.141.119.228.61270: Flags [P.], seq 13920:14076, ack 1, win 501, length 156
09:41:37.817124 IP 134.122.37.253.22 > 72.141.119.228.61270: Flags [P.], seq 14076:14232, ack 1, win 501, length 156
09:41:37.817363 IP 134.122.37.253.22 > 72.141.119.228.61270: Flags [P.], seq 14232:14388, ack 1, win 501, length 156
09:41:37.817550 IP 134.122.37.253.22 > 72.141.119.228.61270: Flags [P.], seq 14388:14544, ack 1, win 501, length 156
09:41:37.817711 IP 134.122.37.253.22 > 72.141.119.228.61270: Flags [P.], seq 14544:14700, ack 1, win 501, length 156
09:41:37.817869 IP 134.122.37.253.22 > 72.141.119.228.61270: Flags [P.], seq 14700:14856, ack 1, win 501, length 156
09:41:37.823680 IP 72.141.119.228.61270 > 134.122.37.253.22: Flags [.], ack 6896, win 4139, length 0
09:41:37.823769 IP 134.122.37.253.22 > 72.141.119.228.61270: Flags [P.], seq 14856:15012, ack 1, win 501, length 156
09:41:37.823795 IP 72.141.119.228.61270 > 134.122.37.253.22: Flags [.], ack 7072, win 4138, length 0
09:41:37.823807 IP 72.141.119.228.61270 > 134.122.37.253.22: Flags [.], ack 7248, win 4137, length 0
09:41:37.823815 IP 72.141.119.228.61270 > 134.122.37.253.22: Flags [.], ack 7424, win 4136, length 0
09:41:37.823823 IP 72.141.119.228.61270 > 134.122.37.253.22: Flags [.], ack 7600, win 4136, length 0
09:41:37.823843 IP 72.141.119.228.61270 > 134.122.37.253.22: Flags [.], ack 7776, win 4135, length 0
100 packets captured
107 packets received by filter
0 packets dropped by kernel